title,link,description,bloggername,bloggerlink,postdate
"캐시미어 스카프 184불, <b>남성 코트</b> 많음 50% 할인코드",https://blog.naver.com/fairyviolet?Redirect=Log&logNo=222160811255,필요) #부히코 #버버리 #버버리직구 #버버리트렌치<b>코트</b> #버버리카<b>코트</b> #버버리캐시미어<b>코트</b>... <b>남성</b> 아우터가 50% 할인코드 되는 게 엄청 많아요. 그런데 A는 작은 것만 있거나 B는 큰 것만 있고... ,프리랜서 부히코의 해외직구 블로그,https://blog.naver.com/fairyviolet,20201202
나에게 잘 맞는 <b>남성코트</b>도 맞춤으로 할 수 있을까?,https://blog.naver.com/sdertgy?Redirect=Log&logNo=222115744754,이번 가을은 저도 인싸들처럼 <b>남성 코트</b> 이쁘게 입어보고 인스타 업로드도 많이 해야겠어요 ㅎ * 본 포스팅은 업체에 실제로 방문하고 느낀점을 솔직하게 적은 후기입니다* #<b>남성코트</b> #<b>남성코트</b>기장 #코트기장,Myeongooo's minimal life,https://blog.naver.com/sdertgy,20201015
<b>남성</b> 겨울 <b>코트</b> 베이직 앞으로 10년은 입을 수 있죠,https://blog.naver.com/darigile?Redirect=Log&logNo=222152451447,<b>남성</b> 겨울 <b>코트</b> 베이직 앞으로 10년은 입을 수 있죠 안녕하세요!! 겨울 <b>코트</b> 시리즈도 본격적으로 리뷰를 시작하려고 합니다. 솔직히 이번 시즌은 지난 시즌과 다르게 신상 <b>코트</b>들이 많이 늦는 편입니다. 이제 곧... ,다리길이SEASON2,https://blog.naver.com/darigile,20201123
분당맞춤정장 쿠보옴므 | <b>남성</b> 헤링본<b>코트</b> 주문 후기,https://blog.naver.com/eunacho0323?Redirect=Log&logNo=222137027548,KUVO HOMME 분당맞춤정장 / 쿠보옴므 / 헤링본<b>코트</b> ■ 주소: 경기도 성남시 분당구 동판교로 52번길 19-7... 남편이 헤링본<b>코트</b>를 입고 싶어 하니 이번에는 오래 입을 수 있는 #분당맞춤정장 매장인 쿠보옴므에서... ,POSSOFARE,https://blog.naver.com/eunacho0323,20201106
<b>남성</b> 겨울 브렌우드 라니피시오 볼륨 <b>코트</b> 추천!,https://blog.naver.com/mcteens?Redirect=Log&logNo=222125564647,그래서 오늘은 그에 걸 맞는 <b>남성</b> 겨울 <b>코트</b>를 하나 추천해드리려 합니다. 예전에 제가 정장 한벌 리뷰하면서 소개해드린 브랜드로 브렌우드 라니피시오 볼륨 <b>코트</b> 입니다. 먼저 제품 소개하는 영상입니다. 한... ,"슈퍼문 Fashion, Golf, Life Log",https://blog.naver.com/mcteens,20201025
"종로 보헨 <b>남성</b>맞춤정장, 맞춤<b>코트</b> 커스터마이징",https://blog.naver.com/sinsasisters?Redirect=Log&logNo=222155352672,갖고 싶었는데 오늘 계획에 없던 터라 잠시 가라 앉히고 상담을 계속 받았다 :) #맞춤<b>코트</b>가격 <b>남성</b> 100만원 / 130만원 여성은 150만원 와이...? 아래 항목은 #웨딩패키징 다 gwp 로 제공된다 gift with purchase 한마디로... ,Over the Moon,https://blog.naver.com/sinsasisters,20201126
"<b>남성</b> 겨울 <b>코트</b>, 브렌우드 라니피시오 볼륨<b>코트</b> 추천해요!",https://blog.naver.com/gjtnwns?Redirect=Log&logNo=222106464819,오늘은 제 블로그를 자주 찾아와주시는 연령층인 20~30대 분들을 위한 <b>남성</b> 겨울 <b>코트</b> 아이템을 준비했습니다. 예전에 정장 브랜드로 한 번 소개해드리기도 했던 브렌우드 BRENTWOOD 라는 곳에서 출시한 20FW 신상품... ,허씨's 라이프스타일,https://blog.naver.com/gjtnwns,20201021
픽 남자 <b>코트</b> 브랜드로 유명한 스튜디오 톰보이 맨즈(<b>남성</b>) 자켓!,https://blog.naver.com/zldnld99?Redirect=Log&logNo=221752251315,"스튜디오 톰보이 맨즈 (<b>남성</b>) <b>코트</b> 자켓인데, 특히 저는 베이지컬러가 무척 남자답고 멋있었어요. 안에 니트를 받쳐입으니 더 깔끔하게 소화할 수 있구요~ 깔끔한 핏의 바지와 함께 입으면 굿굿! 바로 이건데요.... ",이상한 나라의 망고,https://blog.naver.com/zldnld99,20191228
<b>남성 코트</b>를 구매하는 구구절절한 이유,https://blog.naver.com/soyeong0430?Redirect=Log&logNo=222108174364,요즘은 <b>남성 코트</b>를 사기 어려워졌는데 오버사이즈 코트가 유행이기 때문이다. 남성용 오버사이즈 코트를 키 164의 왜소한 내가 입으면 어깨선이 팔꿈치쯤 가있을지도 모르니까... 아 역시 여성은... ,소영이의 수키스러운 공간,https://blog.naver.com/soyeong0430,20201006
여유있게 입을 수 있는 빅사이즈<b>남성코트</b>,https://blog.naver.com/wavesuffer?Redirect=Log&logNo=222174544516,반코트도 있었지만 남자는 롱코트로 가야죠. 빅사이즈<b>남성코트</b>를 구입하고 막 집에 가려는데 친구에게 연락이 왔어요. 어디에 있냐구 묻기에 이태원양복점에 있다고 하니 조금만 기다리라고 합니다.... ,상큼한 키위,https://blog.naver.com/wavesuffer,20201215
[<b>남성코트</b>추천] 남자코트브랜드 2020 TOP3,https://blog.naver.com/designerdesigner?Redirect=Log&logNo=222141549251,[<b>남성코트</b>추천] 남자코트브랜드 2020 TOP3 저번 포스팅에서는 2020년 유행하는 코트스타일에 대해서... 정도의남성 캐주얼의 대장급 브랜드라고 할 수 있습니다. 올해 트랜드에 맞춰 출시된 코트는 전부 루즈핏... ,"탐제이의 남성 패션,미용의 정석",https://blog.naver.com/designerdesigner,20201111
<b>남성</b> 겨울 <b>코트</b> 추천 브렌우드 라니피시오 볼륨<b>코트</b> 코디 후기,https://blog.naver.com/rooster57?Redirect=Log&logNo=222121596302,저는 남자를 가장 남자답게 표현할 수 있는 아이템 중 하나가 바로 <b>남성</b> 겨울 <b>코트</b>라고 생각합니다. 저는 겨울 <b>코트</b>를 초이스 할 때 중요하게 생각하는 게 3가지 정도 있습니다. 그리고 3가지를 충족할... ,문잡고 기다려주는 남자,https://blog.naver.com/rooster57,20201021
<b>남성</b> 겨울 <b>코트</b> 추천 브렌우드 라니피시오 볼륨<b>코트</b> 고급지네요,https://blog.naver.com/hambak88?Redirect=Log&logNo=222135576050,오늘 소개하는 제품이 딱 그런 <b>남성 코트</b>인데요 바로 '브렌우드 라니피시오 볼륨코트'입니다 오늘 소개하는 라니피시오 볼륨 코트의 영상 한 편 볼까요? 브렌우드는 코오롱FnC에서 전개하는 남성복 브랜드로... ,함박,https://blog.naver.com/hambak88,20201104
<b>코트</b> 카카오 라이언 보그 10월호 화보 속 코치 자켓 가방 <b>남성</b>... ,https://blog.naver.com/syokolla?Redirect=Log&logNo=221664321014,"여성<b>코트</b> , <b>남성</b>백팩들을 코치 자켓 , 코지 가방으로 꾸며본 이번 뉴욕 카카오 라이언 보그 10월호 화보 ! 진짜 재밌었어요 ㅎㅎ 라이언 뉴욕 행보를 기념으로 해서, 프로젝트 이미지를 스티커로 제작되었는데... ",쇼콜라비 뷰티&패션을 말하다.,https://blog.naver.com/syokolla,20191001
<b>남성</b> 겨울 <b>코트</b> 추천 브렌우드 라니피시오 볼륨<b>코트</b> 일석이조,https://blog.naver.com/chamomile_t?Redirect=Log&logNo=222121838921,브렌우드 남성 겨울 코트는 그레이와 네이비 톤의 하운드 투스 패턴을 매치한 <b>남성 코트</b>로 일반적인 코드보다는 확실히 고급스러우면서도 깔끔하게 떨어지는 라인 그리고 소재의 고급스러움이 이번 겨울 '정말... ,카모마일T 뷰티 패션 블로그,https://blog.naver.com/chamomile_t,20201025
<b>남성</b> 정장 <b>코트</b> 역대급 깔끔한 디자인,https://blog.naver.com/darigile?Redirect=Log&logNo=221734287633,<b>남성</b> 정장 <b>코트</b> 역대급 깔끔한 디자인 안녕하세요!! 금일은 뉴 데일리룩을 올릴 예정이었는데 연말이라 택배가 많이 밀려서 하루 딜레이가 되었습니다. 때문에 <b>코트</b> 리뷰로 대처합니다. 이번 리뷰템은 이번 시즌... ,다리길이SEASON2,https://blog.naver.com/darigile,20191211
마링에반스 20FW 플란넬 트위드 <b>남성</b>자켓·<b>코트</b> 컬렉션 입고,https://blog.naver.com/esthermoon0722?Redirect=Log&logNo=222113673383,"그래서 오늘, 해리슨테일러는 겨울을 위해 준비한 마링에반스 남성자켓 &amp; 코트 원단을 소개하고자... 특히, 마링에반스 원단의 제작 과정은 복잡하고 꼼꼼하기 때문에 <b>남성코트</b> 및 자켓으로 제작 시 보다... ",해리슨테일러 맞춤정장,https://blog.naver.com/esthermoon0722,20201012
16회 옥택연 패션 속 엠비오(MVIO)! 니트 &amp; <b>남성</b> 더블 <b>코트</b> 코디,https://blog.naver.com/sungdevilsh?Redirect=Log&logNo=221809612229,"※ 출처: MBC 더 게임:0시를 향하여 캡처 (이하 동일) 더 게임 옥택연 패션에서 살펴본 코트 코디 추천룩!... 같은 <b>남성 코트</b>에욘! 그리고 1,2회 속에서의 남성 니트 역시도 동일 브랜드! 소프트한 컬러라서 부드러워... ",쭈's Diary,https://blog.naver.com/sungdevilsh,20200215
<b>남성</b>캐시미어100 맞춤<b>코트</b>,https://blog.naver.com/koni0806?Redirect=Log&logNo=221736265584,"<b>남성</b>맞춤<b>코트</b>, 여성맞춤<b>코트</b> 모두 진행가능하시구요 맞춤제작이시기때문에 고객님이원하시는 스타일로 디자인부터~ 안감, 단추 , 원단소재, 컬러까지도 선택하셔서 세상에서 하나밖에 없는 옷을... ",스플렌디노 한남점❤,https://blog.naver.com/koni0806,20191213
<b>남성 코트</b> 제작 안내,https://blog.naver.com/starishj3?Redirect=Log&logNo=222161817516,"<b>남성코트</b> 주문주신 분들은 제가 개별 연락 드렸습니다! 여섯분 모두... 잔털 제거ㅋㅋ 요청 주셔서.. 제거하여 발송 예정입니다:-) 역시 코트는 빈티지한 느낌보단... 고급맛이 있긴하쥬 제작 제품이여서, 모두... ",Après,https://blog.naver.com/starishj3,20201203
김해맞춤정장 <b>남성</b> 패션 <b>코트</b> 정장 품격,https://blog.naver.com/hktailorcw?Redirect=Log&logNo=221730633834,"남성 패션 하면 먼저 생각나는 것이 정장 코트 캐주얼룩 등 다양한 아이템 있을 거예요. 그중에서도... 너무 두껍지도 얇지도 않기 때문에 겨울용 <b>남성 코트</b> 기본이며, 가격도 적당해서 맞추어 입기 좋아요.... ",창원맞춤정장 루반테일러,https://blog.naver.com/hktailorcw,20191208
2021 봄여름 <b>남성</b> 컬렉션 ⎮ 트레드 슬릭&amp;트렌치<b>코트</b> 코디 룩  !,https://blog.naver.com/ronaldawa?Redirect=Log&logNo=222166306379,알렉산더 맥퀸으로부터 원고료를 제공받아 작성되었습니다. #알렉산더맥퀸2021봄여름<b>남성</b> 컬렉션 #알렉산더맥퀸트레드슬릭 #알렉산더맥퀸트렌치<b>코트</b> #알렉산더맥퀸21SS<b>남성</b>컬렉션 #AlexanderMcQueen,Mujer Bonita,https://blog.naver.com/ronaldawa,20201208
<b>남성</b>)20F/W 구ㅉ 테일러드 울 헤링본 남자 싱글 <b>코트</b>,https://blog.naver.com/hwang106ej?Redirect=Log&logNo=222163589927,(현재 판매율 1위제품 입니다) 울소재 싱글 모던 클레식 코트 최신상 제품 입니다. 크리스마스와 너무 잘어울리는 클레식한 <b>남성 코트</b> 입니다. 더 이상 클레식함이 없을 정도로 몸을 감싸는 입체패턴과... ,포포룩,https://blog.naver.com/hwang106ej,20201205
경우의 수 피오 스타일링 <b>남성</b> 하이넥 <b>코트</b> 코디,https://blog.naver.com/hyen_2?Redirect=Log&logNo=222159442949,경우의 수 피오 스타일링 남성 하이넥 코트 코디 10년에 걸쳐 서로를 짝사랑하는 여자와 남자의 리얼... 하이넥 코트 정보를 소개해드렸구요. 겨울 <b>남성 코트</b> 찾으셨던 분들께 오늘 소개해드린 시스템옴므 제품... ,데일리 혜니,https://blog.naver.com/hyen_2,20201201
<b>남성</b> 겨울 <b>코트</b> 추천 ❄ 브렌우드 라니피시오 볼륨<b>코트</b> 품격... ,https://blog.naver.com/rhksgn?Redirect=Log&logNo=222126317850,"개인적으로 겨울에도 스타일을 포기할 수 없기에 <b>남성</b> 겨울 <b>코트</b>를 추천해보는데요. 슬림한 핏으로 스타일을 잡아주고, 좋은 소재로 따뜻하면서 가볍고 포근한 느낌의 브렌우드 라니피시오 볼륨<b>코트</b>!!!... ",딸기소보루의 ' Hobbylog ',https://blog.naver.com/rhksgn,20201025
피오 남자<b>코트</b>코디 송지오옴므 <b>남성</b>롱<b>코트</b> 패션 !,https://blog.naver.com/yuiop1193?Redirect=Log&logNo=222150571240,맨투맨입니다 ♬ #남자코트 #남자코트코디 #<b>남성코트</b> #남자롱코트 #남자코트브랜드 #<b>남성코트</b>브랜드 #송지오 #송지오옴므 #남자패션 #남성복 #연예인패션 #셀럽 #피오패션 #피오코트 #송지오코트... ,:: 달달한 오후의 레이나 ::,https://blog.naver.com/yuiop1193,20201121
알렉산더 맥퀸 2021 봄여름 <b>남성</b> 컬렉션 트레드 슬릭&amp;트렌치<b>코트</b>,https://blog.naver.com/yeonbin1203?Redirect=Log&logNo=222166909283,알렉산더 맥퀸 2021 봄여름 <b>남성</b> 컬렉션 트레드 슬릭&amp;트렌치<b>코트</b> 출처: 알렉산더 맥퀸(Alexander McQueen) 한 달도 채 남지 않은 2020년. 브랜드들마다 다가오는 2021년을 앞두고 발 빠르게 2021 SS 컬렉션을... ,.,https://blog.naver.com/yeonbin1203,20201208
<b>남성</b> 봄 <b>코트</b> 헤드메이너 실루엣에 반하다,https://blog.naver.com/darigile?Redirect=Log&logNo=221897895331,<b>남성</b> 봄 <b>코트</b> 헤드메이너 실루엣에 반하다 안녕하세요!! 금일 리뷰는 아마 이번 시즌 마지막 <b>코트</b> 리뷰가 될 것 같습니다. 계절감에 맞게 후기를 쓰고 있어서 다시 <b>코트</b>류를 본격적으로 착용해야 하는 9월에나... ,다리길이SEASON2,https://blog.naver.com/darigile,20200408
<b>남성</b> 블랙 가죽 롱<b>코트</b>를 레드 베지터블 가죽 롱<b>코트</b>로 맞춤... ,https://blog.naver.com/yhkim1990?Redirect=Log&logNo=222165551511,Leather &amp; Fur 가죽전문점 남자 가죽 롱<b>코트</b> 맞춤제작 <b>남성</b> 가죽 롱<b>코트</b> 주문제작 다시 떠오르는 대세 '가죽' 다들 집에 가죽자켓 한 벌쯤은 갖고 있을텐데요! 유행에 맞추기 때문에 패션에 민감해질 수 밖에... ,명동 가죽 전문점 YH.KIM,https://blog.naver.com/yhkim1990,20201207
<b>남성</b> 맞춤<b>코트</b>로 인기 많은 스타일은 무엇?,https://blog.naver.com/spd8713?Redirect=Log&logNo=222115578321,체스터 필드 코트는 많은 <b>남성코트</b> 중에서 가장 격식을 갖추고 전통적인 멋을 느낄 수 있는 코트라고... 다음으로 소개할 코트는 남성 맞춤코트로 인기가 좋은 발마칸 코트(Balmacaan Coat)입니다. 발마칸 코트 하면... ,부천맞춤정장 스플렌디노,https://blog.naver.com/spd8713,20201014
완료 [ 케빈클라인 ] <b>남성</b> 퀼팅 안감 <b>코트</b>,https://blog.naver.com/kate_young?Redirect=Log&logNo=222148387461,케빈클라인 <b>남성</b> 트위드 <b>코트</b> 입니다. 백화점 전용 매장 제품으로 미국 출시가격은 한화 50만원이 살짝 넘는 제품 한국 매장가는 훨씬 고가 였겠죠? -&gt; 10만원 대 핫딜! 그레이 트위드로 어디에나... ,델리케이트핫딜,https://blog.naver.com/kate_young,20201119
<b>남성 코트</b> 캐주얼하면서도 고급스럽게!,https://blog.naver.com/dnlftmxhdj02?Redirect=Log&logNo=221852179863,우선 이번 <b>남성 코트</b>의 가장 큰 스펙이자 장점으로 꼽을 수 있는 오늘 아이템의 소재 부분에 대하여 자세하게 설명드려보도록 해볼게요~!! 오늘 주인공은 코튼과 텐셀 원단 두 가지 원단이 혼용된 혼용 원단으로... ,윌스토어,https://blog.naver.com/dnlftmxhdj02,20200313
2020.12 Theory <b>남성코트</b> &amp; 바버 애쉬비 왁스자켓... ,https://blog.naver.com/mge3?Redirect=Log&logNo=222177155944,블랜드의 <b>코트</b>. 난 직구에 눈을 뜨게 된 것이야.. 나의 욕망을 멈출수 없어... 두번째 직구템 영국에서 날라온 Barbour 애쉬비 <b>남성</b> 왁스자켓 핫딜한 END clothing 박스를 열고 포장 종이를 열어보니 이렇게..... ,*With U,https://blog.naver.com/mge3,20201217
지오송지오 겨울 <b>남성 코트</b> 후기 다크베이지 오버핏 캐시미어... ,https://blog.naver.com/jsjahong2?Redirect=Log&logNo=221836668553,쉽게풀어낸 남성 캐릭터 브랜드이며 디자이너의 예술적인 감성과 캐릭터 브랜드의 트렌디함이 접목된... #지오송지오 #지오송지오몰 #남자코트 #<b>남성코트</b> #지오송지오코트 #베이지코트 #다크베이지코트... ,홍시스터즈♡♡,https://blog.naver.com/jsjahong2,20200304
[2020 소비자평가 10대 브랜드] <b>남성코트</b> 부문,https://blog.naver.com/kma450815?Redirect=Log&logNo=222097631263,"빈폴 <b>남성코트</b> / 출처 : SSFSHOP 기나긴 장마로 많은 국민이 힘들어 했던 여름이 지나가고, 어느덧... 소비자평가는 20FW 시즌을 맞이해, 남성 스타일링의 핵심 아이템 중 하나인 코트 브랜드를 선정하고자... ",소비자평가,https://blog.naver.com/kma450815,20200923
"[MooRer]아울렛/무레르 <b>남성</b> 더플<b>코트</b> 네이비 46,52",https://blog.naver.com/oasishs?Redirect=Log&logNo=222134412445,"무레르 기다리시는분 많으신데, 제가 가는 멀티아울렛에 무레르 입고가 무지 더디네요 ㅜ 오늘은 <b>남성</b> 더플<b>코트</b> 하나 소개해 드릴께요:) 캐시미어 10%믹스된 울소재인데, 소재 넘 고급지고 좋아요. 최상급... ",CiaoMilan,https://blog.naver.com/oasishs,20201103
[건대정장 STCO 건대입구점] 가성비 좋은 <b>남성코트</b> 남성정장,https://blog.naver.com/jian131?Redirect=Log&logNo=222156196377,"건대정장, <b>남성코트</b>를 찾아보세요 #건대정장 #남성정장 #<b>남성코트</b> #STCO건대입구점 #STCO #건대남자코트 #건대남자옷가게 #건대남성정장 #건대면접정장 #건대남성복 #건대남자옷 #건대입구정장 #건대입구면접복",지구별 여행자 도희,https://blog.naver.com/jian131,20201127
캐시미어 <b>남성 코트</b> 살짜쿵~!^^,https://blog.naver.com/kjk621126?Redirect=Log&logNo=222180991489,<b>남성코트</b> 보여드릴려고 잠시 들렀습니다. 브랜드 옷으로 매장가 300가까이 하는 진짜진짜 깜놀 좋은옷이에요. 이옷도 역시 블로그 이웃님들께 먼저 선보여드릴게요^^ 살짝 사진만 보여드리고 저는 물러갑니다... ,"함께 아름답게, 다롱맘 편집샵",https://blog.naver.com/kjk621126,20201221
LF몰 <b>남성코트</b> 할인 정보 겨울 패딩자켓 신상품 입고 헤지스... ,https://blog.naver.com/fiveday2?Redirect=Log&logNo=222154412783,겨울 <b>남성 코트</b>를 찾으셨다면 LF몰에서 할인 받으셔서 올해 신상품을 GET LF몰은 현재 코로나 시기에... 남성 패딩코트 남성 뽀글이 패딩코트 헤지스 THE상품(롱점퍼도 있습니다.) 헤지스 패딩점퍼 신상품도 입고... ,LF몰 스토어 아산헤지스점,https://blog.naver.com/fiveday2,20201125
스튜디오 톰보이 맨즈(<b>남성</b>) <b>코트</b> 자켓 : 강다니엘 패션 &amp; 김재영... ,https://blog.naver.com/pureminiv?Redirect=Log&logNo=221751013843,요즘 남자 연예인들 패션에서 자주 보이는 스튜디오 톰보이 맨즈(<b>남성</b>) <b>코트</b> 자켓~ Studio Tomboy는 시즌마다 트렌디한 감성으로 많은 사랑을 받고 있는 컨템포러리 캐주얼 브랜드로 올해 맨즈 라인을 새롭게 런칭... ,뷰스타 차밍밍의 레인보우 스토리♡,https://blog.naver.com/pureminiv,20191227
Club Monaco *세일 *또세일~♡ 울<b>코트</b> <b>남성</b>,https://blog.naver.com/iam-sun?Redirect=Log&logNo=221815681584,남성 울혼방 코트 입니다 저~ 제가 올릴거 많아서가 아니라 그냥 사진 보시면~ 별로 설명 드릴 필요가 없지~ 싶습니다. 그렇쵸~^^♡ ■소재■ 59% 울 38% 폴리 가볍고 따뜻합니다 색상은 멋쟁이 겨울<b>남성코트</b>의... ,오늘은여기,https://blog.naver.com/iam-sun,20200219
헤지스 <b>남성</b> 점퍼 <b>코트</b> 단정한 데일리룩,https://blog.naver.com/goodtody71?Redirect=Log&logNo=222141242842,"헤지스 남성 점퍼입니다. 솔리드 컬러와 히든 버튼 디테일이 깔끔해 보이는 구스다운 베이직 코트예요.... <b>남성코트</b>, 점퍼등 아우터는 패션플러스에서 만나실 수 있습니다. #헤지스<b>남성코트</b> #헤지스남성점퍼",다정한 먹로그,https://blog.naver.com/goodtody71,20201111
"20, 퀼트 <b>코트</b> $119.69, <b>남성</b> 탑<b>코트</b> $172.89 @메이시스.",https://blog.naver.com/buytheworld?Redirect=Log&logNo=222139762792,10 오후 2시까지) <b>남성</b> 울블랜드 탑 <b>코트</b> 제품 자체 할인 50% 되어 246.99불이고 할인코드 적용하면 172.89불로 구매가능하네요^^ Lauren Ralph Lauren Men’s Luther Wool Blend Top Coat - $246.99 30... ,해외쇼핑 할인정보,https://blog.naver.com/buytheworld,20201109
"수트핏이 매력적인 <b>남성 코트</b>, 지오송지오 채스터필드 코트... ",https://blog.naver.com/zzzzz759?Redirect=Log&logNo=222146003948,+ 채스터필드 <b>코트</b> 정의 폭이 좁은 <b>남성</b>용 <b>코트</b>로 줄여서 체스터필드라고 부릅니다. 검정 벨벳의 칼라가 있고 길이는 무릎 밑까지 온다. 19세기 영국의 체스터필드 4세 백작이 입어서 이런 명칭이 붙었다.... ,M.Log,https://blog.naver.com/zzzzz759,20201116
겨울 <b>코트</b> 맞춤 디자인 살펴보기 - ① <b>남성</b>맞춤<b>코트</b>,https://blog.naver.com/ssosoman?Redirect=Log&logNo=222141727398,겨울 코트 맞춤 디자인 살펴보기 - ① 남성맞춤코트 안녕하세요:) 맞춤정장 브랜드 루쏘소를... 다양한 <b>남성 코트</b> 디자인에 대해 설명해드렸습니다 <b>남성 코트</b> 디자인은 몇 가지 타입으로 나눌 수는 있겠지만... ,Lussoso Official Blog,https://blog.naver.com/ssosoman,20201111
코오롱스포츠 NEW<b>남성</b>... 브렌우드 솔리드 캐시미어 울<b>코트</b>),https://blog.naver.com/cbr1992?Redirect=Log&logNo=222171337239,♡ #코오롱몰 #코오롱스포츠패딩 #헤스티아롱패딩 #코오롱스포츠헤스티아롱패딩 #남성헤스티아롱다운... 남자패딩 #남자울코트 #브렌우드솔리드캐시미어울코트 #브렌우드<b>남성코트</b> #코오롱몰패딩행사,내가기억이안나서 기억하려고시작한블로그,https://blog.naver.com/cbr1992,20201212
[지오송지오<b>남성코트</b>] 체형별 어울리는 코트 스타일링,https://blog.naver.com/zio0098?Redirect=Log&logNo=222162618537,"안녕하세요 지오송지오<b>남성코트</b> 지오송지오문정점입니다 코트의 계절, 겨울이 돌왔습니다 한겨울에 가까워지면서 본격적으로 겨울맞이를 해야 하지만 칼바람과 싸우기 싫다고 스타일을 포기할 수도 없는... ",지오송지오문정점,https://blog.naver.com/zio0098,20201204
(40%세일가) 단톤 나일론 터프터 <b>코트</b> <b>남성</b>사이즈,https://blog.naver.com/ryang419?Redirect=Log&logNo=221976397173,터프터 <b>코트</b>입니다 ^^ 요제품은 40프로 세일가이구요 타임세일이라 오래 진행 못하니 빠른 결정 부탁드리며 소개해드리겠습니다 !! DANTON 나일론 터프터 <b>코트</b> 칼라&amp;사이즈_ 베이지 38/40/42 네이비 38/40 38... ,Tokyo log 일본구매대행 및 일상이야기,https://blog.naver.com/ryang419,20200524
한양도성 홍보 행사 뉴이스트 아론 옷 정보 <b>남성</b> 더블 <b>코트</b>,https://blog.naver.com/oddangzzigae?Redirect=Log&logNo=221733292072,좋은 <b>남성 코트</b>입니다 바깥에 포켓은 물론 안쪽에도 포켓이 있어 실용성 면에서도 좋답니다 ^^ 여성분들이나 남성분들 요즘 코트 많이 입으시죠? 저도 가장 좋아하는 겨울 패션이 코트 패션이랍니다 ㅎㅎㅎ... ,우주인과 짱가네 지구별 이야기,https://blog.naver.com/oddangzzigae,20191210
마시모두띠 <b>남성</b> 울 하운드 투스 <b>코트</b> / <b>남성</b>겨울<b>코트</b> /까사데실,https://blog.naver.com/dbzh9050?Redirect=Log&logNo=222122116436,"울100% 안감처리 안쪽 가슴주머니 O 스트레이트 핏으로 <b>남성</b>분들의 쉬크함을 제대로 뿜뿜해줄 <b>코트</b>랍니다 46 48 50 52 54 56 국내 39만9천원에 판매중입니다 문의는 댓글 바랍니다 해외 직배송 배송기간 2,3주",Casa de S i l,https://blog.naver.com/dbzh9050,20201021
[초핫딜] 라코스테 <b>남성</b> 후드 집업 프리미엄 울 <b>코트</b>/BH8424,https://blog.naver.com/getmoreshop?Redirect=Log&logNo=222099351065,라코스테 남성 후드 집업 프리미엄 울 코트 초핫딜 입니다. 언제나 보여드리면 저도 기분 좋은 라코스테 초핫딜이에요. 이번에 보여드리는 <b>남성 코트</b>. 대박 상품이에요. 정가 무려 60만원 후반대... ,겟모어샵(Getmore shop),https://blog.naver.com/getmoreshop,20200925
